{
  "id": "registry-partition-by-version",
  "version": "0.1.0",
  "schema": "/data/registry/schemas/registry-partition.schema.json",
  "status": "foundation",
  "runtimeStatus": "not-consumed",
  "createdAt": "2026-07-09",
  "updatedAt": "2026-07-09",
  "owner": "Calcule Trabalhador",
  "source": "Productivity Layer Phase 2.3 - Registry Partitioning System",
  "partition": "by-version",
  "description": "Partition prepared to discover assets by version.",
  "entries": [],
  "entryShape": ["id", "type", "slug", "status", "owner", "version", "references"],
  "notes": ["Version partitions are indexes only and do not store full historical content."]
}
